{
  "$schema": "http://json-schema.org/draft-07/schema#",
  "$id": "https://raw.githubusercontent.com/pulsemcp/air/main/schemas/plugin-manifest.schema.json",
  "title": "AIR Plugin Manifest",
  "description": "The body of a single AIR plugin, stored at <plugin-dir>/.plugin/plugin.json and referenced by `path` from a plugins.json index entry. This is AIR's vendor-neutral analog of the Open Plugins `.plugin/plugin.json` manifest: it carries the plugin's bundled artifact references (skills, mcp_servers, hooks, plugins) and distribution metadata. Unlike Open Plugins, the component fields hold AIR artifact IDs (references into skills.json / mcp.json / hooks.json indexes) rather than paths to bundled component directories. The owning plugins.json entry remains a lightweight registry (description + path + default_in_roots); fields it declares inline take precedence over this manifest.",
  "type": "object",
  "properties": {
    "$schema": {
      "type": "string",
      "description": "JSON Schema reference for validation."
    },
    "name": {
      "type": "string",
      "description": "Plugin identifier. Optional and informational — the authoritative ID is the key of the plugins.json entry that references this manifest. Included for Open Plugins compatibility."
    },
    "title": {
      "type": "string",
      "minLength": 1,
      "maxLength": 100,
      "description": "Human-readable display name for the plugin."
    },
    "description": {
      "type": "string",
      "minLength": 1,
      "maxLength": 500,
      "description": "Concise description of what this plugin provides. The plugins.json index entry's description takes precedence when both are present."
    },
    "version": {
      "type": "string",
      "pattern": "^[0-9]+\\.[0-9]+\\.[0-9]+([-+][a-zA-Z0-9._-]+)?$",
      "description": "Semantic version of the plugin (e.g., '1.0.0')."
    },
    "skills": {
      "type": "array",
      "items": { "type": "string" },
      "description": "IDs of skills bundled by this plugin. Must reference skill IDs defined in skills.json indexes."
    },
    "mcp_servers": {
      "type": "array",
      "items": { "type": "string" },
      "description": "IDs of MCP servers bundled by this plugin. Must reference server IDs defined in mcp.json indexes."
    },
    "hooks": {
      "type": "array",
      "items": { "type": "string" },
      "description": "IDs of hooks bundled by this plugin. Must reference hook IDs defined in hooks.json indexes."
    },
    "plugins": {
      "type": "array",
      "items": { "type": "string" },
      "description": "IDs of other plugins to compose into this plugin. Referenced plugins' primitives are recursively expanded and merged. Circular references are rejected at resolution time."
    },
    "author": {
      "type": "object",
      "description": "Plugin author information.",
      "properties": {
        "name": { "type": "string", "description": "Author's name." },
        "email": { "type": "string", "format": "email", "description": "Author's email address." },
        "url": { "type": "string", "format": "uri", "description": "Author's website or profile URL." }
      },
      "additionalProperties": true
    },
    "homepage": {
      "type": "string",
      "format": "uri",
      "description": "URL to the plugin's homepage or documentation."
    },
    "repository": {
      "type": "string",
      "description": "URL or identifier for the plugin's source repository."
    },
    "license": {
      "type": "string",
      "description": "SPDX license identifier (e.g., 'MIT', 'Apache-2.0')."
    },
    "logo": {
      "type": "string",
      "description": "Path or URL to the plugin's logo image."
    },
    "keywords": {
      "type": "array",
      "items": { "type": "string" },
      "description": "Keywords for discovery and categorization."
    }
  },
  "additionalProperties": true
}
