{
  "$schema": "../../../../schemas/plugin-manifest.schema.json",
  "name": "deploy-toolkit",
  "title": "Deployment Toolkit",
  "description": "End-to-end deployment skills, hooks, and CI/CD MCP server for staging and production environments",
  "version": "2.0.1",
  "skills": ["deploy-staging", "deploy-production"],
  "mcp_servers": ["ci-cd"],
  "hooks": ["pre-deploy-check", "post-deploy-notify"],
  "author": {
    "name": "Acme Platform Team"
  },
  "license": "Apache-2.0",
  "keywords": ["deploy", "ci-cd", "staging", "production"]
}
